{
  "$schema": "http://json-schema.org/draft-04/schema#",
  "id": "https://api.maas.global/v1/profile",
  "description": "MaaS user profiles",
  "type": "object",
  "properties": {
    "identityId": {
      "$ref": "aws.json#definitions/cognitoIdentityId"
    },
    "plans": {
      "type": "array",
      "items": {
        "$ref": "package.json#definitions/plan"
      }
    },
    "favoriteLocations": {
      "type": "array",
      "items": {
        "$ref": "#/definitions/favoriteLocation"
      }
    },
    "balance": {
      "type": "number"
    },
    "phone": {
      "$ref": "units.json#definitions/phone"
    },
    "email": {
      "$ref": "units.json#definitions/email"
    }
  },
  "additionalProperties": false,
  "required": [ "plans", "favoriteLocations", "balance", "phone", "email" ],
  "definitions": {
    "favoriteLocation": {
      "type": "object",
      "properties": {
        "name":{
          "type": "string",
          "required": true
        },
        "address":{
          "type": "string",
          "required": true
        },
        "lat":{
          "$ref": "units.json#definitions/latitude"
        },
        "lon":{
          "$ref": "units.json#definitions/latitude"
        }
      }
    }
  }
}
